text_a	label
Unidentified gunmen dragged 10 men out ot their homes in a rural area of Colombia 's northwest province of Antioquia and shot them to death , authorities said on Sunday .	O O O O O O O O O O O O O O B-LOC O O O O B-LOC O O O O O O O O O O O
SOCCER - SEYCHELLES FAIL IN BID FOR HISTORIC VICTORY .	O O B-LOC O O O O O O O
Horst Siegl ( 24th , 48th , 80th ) , Zdenek Svoboda ( 76th ) , Petr	B-PER I-PER O O O O O O O O B-PER I-PER O O O O B-PER
15-2 17-14	O O
" We have a suitable exchange rate .	O O O O O O O O
Chicago Cubs right fielder Sammy Sosa underwent surgery on Monday to remove a fractured bone from his right hand and will miss four to six weeks , the club announced Tuesday .	B-ORG I-ORG O O B-PER I-PER O O O O O O O O O O O O O O O O O O O O O O O O O O
" I think this is a bad beginning .	O O O O O O O O O
Welcome to the club .	O O O O O
Pakistan lead the series 1-0 .	B-LOC O O O O O
CENTRAL DIVISION	B-MISC I-MISC
Torpedo Zaporizhya 2 Shakhtar Donetsk 1	B-ORG I-ORG O B-ORG I-ORG O
The Tigers won their third straight and halted a seven-game road losing streak behind Justin Thompson ( 1-2 ) , who earned his first major-league win .	O B-ORG O O O O O O O O O O O O B-PER I-PER O O O O O O O O O O O
The chairman of the local council , Damian Ejiohuo , said drugs had been rushed to the area to quell the disease and the community needed a safer source of drinking water to prevent future outbreaks .	O O O O O O O B-PER I-PER O O O O O O O O O O O O O O O O O O O O O O O O O O O O
Ferrigato , winner of the Leeds Classic last Sunday with a one second win over Britain 's Max Sciandri , posted a similarly narrow margin of victory again .	B-PER O O O O B-MISC I-MISC O O O O O O O O B-LOC O B-PER I-PER O O O O O O O O O O
" I know what I 'm here for , " said Medvedev , who lost in the second round of the Open the last two years after reaching the quarters in 1993 , the same year he tried his hand as a restaurant critic .	O O O O O O O O O O O B-PER O O O O O O O O O B-MISC O O O O O O O O O O O O O O O O O O O O O O O
Standings ( tabulate under played , won , drawn , lost , points	O O O O O O O O O O O O O
An Iranian exile group based in Iraq vowed on Thursday to extend support to Iran 's Kurdish rebels after they were attacked by Iranian troops deep inside Iraq last month .	O B-MISC O O O O B-LOC O O O O O O O B-LOC O B-MISC O O O O O O B-MISC O O O B-LOC O O O
-DOCSTART-	O
LONDON 3,907.5 +16.4 3,907.5 3,632.3	B-LOC O O O O
Chang committed an untidy 53 unforced errors , though he made seven fewer than the Brazilian , who also walloped a woeful 24 double faults .	B-PER O O O O O O O O O O O O O O B-MISC O O O O O O O O O O
" I hate you f... ing lot , yet you 're always asking me too many things .	O O O O O O O O O O O O O O O O O O
He is appealing in both cases to the Supreme Court .	O O O O O O O O B-ORG I-ORG O
Three plugged water injection wells on the Heidrun oilfield off mid-Norway will be reopened over the next month , operator Den Norske Stats Oljeselskap AS ( Statoil ) said on Thursday .	O O O O O O O B-LOC O O B-MISC O O O O O O O O O B-ORG I-ORG I-ORG I-ORG I-ORG O B-ORG O O O O O
BASEBALL - MAJOR LEAGUE STANDINGS AFTER SATURDAY 'S GAMES .	O O B-MISC I-MISC O O O O O O
SAN DIEGO 72 60 .545 -	B-ORG I-ORG O O O O
Senior Hong Kong civil servants were given the go-ahead on Thursday to challenge a government ban on them standing for the Beijing-backed panel to choose the territory 's first post-handover leader and lawmakers .	O B-LOC I-LOC O O O O O O O O O O O O O O O O O O B-MISC O O O O O O O O O O O O
In 1993 , she fell in Rome and broke three ribs .	O O O O O O B-LOC O O O O O
-DOCSTART-	O
-DOCSTART-	O
TORONTO 60 69 .465 14	B-ORG O O O O
But the driver 's wife kept her nerve , got out her camera and photographed him .	O O O O O O O O O O O O O O O O O
30,000 .	O O
- Pakistan bought 31,412 tonnes of PL-480 No.2 yellow soybeans from Cargill Inc for $ 303.19 per tonne , FOB U.S. Gulf , agents for the buyer said .	O B-LOC O O O O O O O O O B-ORG I-ORG O O O O O O O B-LOC I-LOC O O O O O O O
Estimates ( Dfl ) : EPS P / E Dividend	O O B-MISC O O O O O O O
Frederic Vitoux ( France ) beat Ramon Delgado ( Paraguay ) 6-4 6-4 7-6 ( 7-3 )	B-PER I-PER O B-LOC O O B-PER I-PER O B-LOC O O O O O O O
tennis tournament on Saturday ( prefix numbers denotes	O O O O O O O O
The evening of the same day the missionaries were put in prison or isolation .	O O O O O O O O O O O O O O O
The three main lists have been prepared .	O O O O O O O O
Fulham 3 2 0 1 4 3 6	B-ORG O O O O O O O
Bangladesh Speaker says he received death threats .	B-LOC O O O O O O O
-DOCSTART-	O
The league season starts on September 8 .	O O O O O O O O
Bradford 22 17 0 5 767 409 34	B-ORG O O O O O O O
He made the allegations at the trial of an Iranian and four Lebanese accused of carrying out the attack .	O O O O O O O O O B-MISC O O B-MISC O O O O O O O
LONDON 1996-08-26	B-LOC O
Antwerp 1 Lommel 4	B-ORG O B-ORG O
SYDNEY 1996-08-26	B-LOC O
Levy said that Best planned to open two new stores this fall .	B-PER O O B-ORG O O O O O O O O O
-- Damien Lynch , Dublin Newsroom +353 1 6603377	O B-PER I-PER O B-ORG I-ORG O O O
Referring to Gencor 's increased 41.5 percent stake in Ingwe , Gilbertson said the group would wait for coal shares to be cheaper before considering snapping up more .	O O B-ORG O O O O O O B-ORG O B-PER O O O O O O O O O O O O O O O O O
10 Year A-rated Gen'l Obligation 4.90 % 4.90 % -----	O O O O O O O O O O
-DOCSTART-	O
-- Kolumbina Bencevic , Zagreb Newsroom , 385-1-4557075	O B-PER I-PER O B-ORG I-ORG O O
Rakow Czestochowa 1 Stomil Olsztyn 4	B-ORG I-ORG O B-ORG I-ORG O
Jackson , the only man to have run faster , could not live with his speed , taking second in 13.24 seconds .	B-PER O O O O O O O O O O O O O O O O O O O O O O
1. Derrick Adkins ( U.S. ) 47.93 seconds	O B-PER I-PER O B-LOC O O O
The pilot said several hijackers appeared to be placed around the plane .	O O O O O O O O O O O O O
The blonde Australian opened with a level par round of 70 in Akron , leaving him four shots adrift of the leaders , Americans Billy Mayfair and Paul Goydos and Japan 's Hidemichi Tanaki .	O O B-MISC O O O O O O O O O B-LOC O O O O O O O O O O B-MISC B-PER I-PER O B-PER I-PER O B-LOC O B-PER I-PER O
Over 2,000 striking workers voted on Friday to return to work on Monday at Toyota Australia 's Melbourne assembly line , ending a two-week stoppage .	O O O O O O O O O O O O O O B-ORG I-ORG O B-LOC O O O O O O O O
Revenue freight-tonne kilometres ( million ) 1,600 up 7 pct	O O O O O O O O O O
The Salang highway , Afghanistan 's main route to Central Asia , has been controlled by Dostum since he began fighting President Burhanuddin Rabbani 's government in Kabul in January 1994 in alliance with Hezb-i-Islami party leader Gulbuddin Hekmatyar , then prime minister but rival to the president .	O B-LOC O O B-LOC O O O O B-LOC I-LOC O O O O O B-PER O O O O O B-PER I-PER O O O B-LOC O O O O O O B-ORG O O B-PER I-PER O O O O O O O O O O
Gujral said India would re-examine its position if the treaty , particularly a clause providing for its entry into force , was modified .	B-PER O B-LOC O O O O O O O O O O O O O O O O O O O O O
8 equal .	O O O
Harwood ( Australia ) , Brenden Pappas ( South Africa ) , Peter	B-PER O B-LOC O O B-PER I-PER O B-LOC I-LOC O O B-PER
" They 're aiming millions and millions of missiles right at these young people , whether it 's a needle , whether it 's a cigarette , whatever the delivery system is -- it 's poison and it 's got to stop in America . "	O O O O O O O O O O O O O O O O O O O O O O O O O O O O O O O O O O O O O O O O O O O B-LOC O O
NEW YORK 1996-08-27	B-LOC I-LOC O
S.B.K- Brooks Investment Corp .	B-ORG I-ORG I-ORG I-ORG O
He said his farm , its 260 workers now readying the fields for winter wheat sowing , expected the land to yield 5.2 tonnes per hectare ( 2.5 acres ) but ended up with 3.9 tonnes -- still better than the national average of 2.11 tonnes per hectare this year .	O O O O O O O O O O O O O O O O O O O O O O O O O O O O O O O O O O O O O O O O O O O O O O O O O O O
( Parent ) FORECAST FORECAST YEAR-AGO	O O O O O O
Chuck Finley ( 12-12 ) snapped a four-game losing streak .	B-PER I-PER O O O O O O O O O
BRUSSELS 1996-08-29	B-LOC O
Fox said the incident had strained relations between the two governments .	B-PER O O O O O O O O O O O
LONDON 1996-08-26	B-LOC O
118 , A. Cottey 70 ) .	O O B-PER I-PER O O O
Ischinger said the threat of a major assault to take Grozny had been the unauthorised initiative of the commanding general and not Moscow 's intention .	B-PER O O O O O O O O O B-LOC O O O O O O O O O O O B-LOC O O O
72 72 , Craig Parry ( Australia ) 73 75 67 72 , Willie Wood 75 69	O O O B-PER I-PER O B-LOC O O O O O O B-PER I-PER O O
Varteks Varazdin win 5-1 on aggregate .	B-ORG I-ORG O O O O O
Possession of 30 grammes ( just over an ounce ) of heroin or five kg ( 11 lb ) of opium is punishable by death in Iran .	O O O O O O O O O O O O O O O O O O O O O O O O O O B-LOC O
Wall Street had expected the company to earn $ 0.17 a share in its fourth quarter , ended June 30 , according to First Call .	B-LOC I-LOC O O O O O O O O O O O O O O O O O O O O O O O O
Winner of the 1969 Nobel Prize for physiology or medicine for work on the genetic structure of viruses that infect bacteria .	O O O O B-MISC I-MISC O O O O O O O O O O O O O O O O
GENEVA 1996-08-26	B-LOC O
Reeve , an accomplished rider who owned several horses , suffered multiple injuries including two shattered neck vertebrae when he was thrown from his horse at an equestrian event in Culpepper , Virginia , on May 27 , 1995 .	B-PER O O O O O O O O O O O O O O O O O O O O O O O O O O O O O B-LOC O B-LOC O O O O O O O
BRUSSELS 1996-08-23	B-LOC O
Kent 14 7 1 6 42 40 212	B-ORG O O O O O O O
Schalke 04 4 0 3 1 5 9 3	B-ORG I-ORG O O O O O O O
Bondholders and other unsecured non-trade creditors will receive warrants four about 2.2 million shares when the company 's market capitalization reaches $ 20 million .	O O O O O O O O O O O O O O O O O O O O O O O O O
CINCO DIAS	B-ORG I-ORG
Blackburn 3 0 1 2 2 5 1	B-ORG O O O O O O O
-DOCSTART-	O
CHICAGO AT HOUSTON	B-ORG O B-LOC
MOSCOW 1996-08-27	B-LOC O
Vorskla Poltava 2 Nyva Ternopil 1	B-ORG I-ORG O B-ORG I-ORG O
MUZAFFARABAD , Pakistan 1996-08-25	B-LOC O B-LOC O
" The industry saw capacity expansion of about 13 percent over 1994/95 from 77.79 million tonnes to 87.45 million tonnes , " Palkhivala told shareholders .	O O O O O O O O O O O O O O O O O O O O O O B-PER O O O
A Shanghai novelist was murdered at her home on Sunday , an official of the city 's Writers Association said on Wednesday .	O B-LOC O O O O O O O O O O O O O O O B-ORG I-ORG O O O O
Still , the governor said the new law does not go as far as the state 's own welfare reform program , dubbed W-2 .	O O O O O O O O O O O O O O O O O O O O O O O B-MISC O
Warwickshire are currently in fourth position behind Yorkshire , Nottinghamshire and Surrey .	B-ORG O O O O O O B-ORG O B-ORG O B-ORG O
New Zealand beat South Africa 33-26 ( halftime 21-11 ) in the second test on Saturday .	B-LOC I-LOC O B-LOC I-LOC O O O O O O O O O O O O
The television also said that Netanyahu had sent messages to reassure Syria via Cairo , the United States and Moscow .	O O O O O B-PER O O O O O B-LOC O B-LOC O O B-LOC I-LOC O B-LOC O
WESTERN DIVISION	B-MISC I-MISC
*	O
" The premium will be no lower than 15 percent and will be set by management before the issue ...	O O O O O O O O O O O O O O O O O O O O
Michael Schumacher of	B-PER I-PER O
In Houston , Jeff Bagwell homered and Donne Wall allowed one run over seven innings as the Houston Astros defeated the St. Louis Cardinals 4-1 .	O B-LOC O B-PER I-PER O O B-PER I-PER O O O O O O O O B-ORG I-ORG O O B-ORG I-ORG I-ORG O O
In the third vote Meri won 52 and Ruutel won 32 votes .	O O O O B-PER O O O B-PER O O O O
18. Vac 3 - - 3 2 8 0	O B-ORG O O O O O O O
COLOMBO 1996-08-28	B-LOC O
NATO military chiefs to visit Iberia .	B-ORG O O O O B-ORG O
2. Isaac Viciosa ( Spain ) 3:33.00	O B-PER I-PER O B-LOC O O
At Weston-super-Mare : Durham 326 ( D. Cox 95 not out ,	O B-LOC O B-ORG O O B-PER I-PER O O O O
* Philip Morris Cos Inc raises dividend 20 percent .	O B-ORG I-ORG I-ORG I-ORG O O O O O
This has nothing to do with the accusation that I am trying to escape the debate , " Banharn told reporters after meeting coalition partners .	O O O O O O O O O O O O O O O O O O B-PER O O O O O O O
Men 's singles	O O O
- WESTERN HEMISPHERE	O B-LOC I-LOC
British Data Management 's shares slipped 0.5 pence to 179.5p , valuing that company at around 45 million stg .	B-ORG I-ORG I-ORG O O O O O O O O O O O O O O O O O
The poll gave Clinton a 53 percent to 39 percent lead over Dole if Perot were not in the race .	O O O B-PER O O O O O O O O B-PER O B-PER O O O O O O
Nice are 18th in the table .	B-ORG O O O O O O
Leading overall standings after second stage .	O O O O O O O
The next match in the four-nation tournament is on Friday when Sri Lanka play Australia in a repeat of the World Cup final in Lahore where Sri Lanka won by seven wickets .	O O O O O O O O O O O B-LOC I-LOC O B-LOC O O O O O B-MISC I-MISC O O B-LOC O B-LOC I-LOC O O O O O
They said they were ready to force their way back across post-war ethnic lines to Serb-held Doboj , one of several towns where NATO troops fear violence involving refugees determined to vote where they once lived .	O O O O O O O O O O O O O O O B-MISC B-LOC O O O O O O B-ORG O O O O O O O O O O O O O
Air Express International said in a statement that Spain has become the twenty-second country in its network to achieve ISO 9002 quality accreditation .	B-ORG I-ORG I-ORG O O O O O B-LOC O O O O O O O O O O B-MISC I-MISC O O O
MSK Zilina 0 FC Kosice 2	B-ORG I-ORG O B-ORG I-ORG O
$ 22,040,000 SER .	O O O O
Nottingham Forest 1 Middlesbrough 1	B-ORG I-ORG O B-ORG O
The Redmond , Wash.-based company spent tens of millions of dollars promoting the product with stunts that included buying the entire print run of the Times of London and lighting New York 's Empire State building in a Windows color scheme .	O B-PER O B-MISC O O O O O O O O O O O O O O O O O O O O O B-ORG I-ORG I-ORG O O B-LOC I-LOC O B-LOC I-LOC O O O B-MISC O O O
14. Martin Brundle ( Britain ) 3	O B-PER I-PER O B-LOC O O
This is the leading story in the Mozambican press on Monday .	O O O O O O O B-MISC O O O O
PULPEX will be both a marketplace and a clearing house , OM said , adding that the British Securities and Investments Board had been informed of OM 's plans .	B-ORG O O O O O O O O O O B-ORG O O O O O B-ORG I-ORG I-ORG I-ORG I-ORG O O O O B-ORG O O O
Widzew Lodz 7 4 2 1 13 3 14	B-ORG I-ORG O O O O O O O
-DOCSTART-	O
COUPON 2.95 % ISS PRICE MATURITY 5 .	O O O O O O O O
Brisbane 21 16 0 5 569 257 32	B-ORG O O O O O O O
Gremio 2 Vitoria 2	B-ORG O B-ORG O
Hartlepool 2 Mansfield 2	B-ORG O B-ORG O
Last column - TOTAL- is latest for jobless and accumulated for the rest ( GDP total amount corresponds to 1995 ) .	O O O O O O O O O O O O O O O O O O O O O O
Latest M4 , currency reserves , industrial production data are provisional .	O O O O O O O O O O O O
- Banco Santander starts conquest of the east .	O B-ORG I-ORG O O O O O O
" We want to pop some air out of this balloon of tension that has been blown up around September 15 , " Cimicchi said .	O O O O O O O O O O O O O O O O O O O O O O O B-PER O O
Men 's 400 metres	O O O O
WASHINGTON 1996-08-28	B-LOC O
Saleh said the team -- from New York 's Metropolitan Museum -- found four Canopic jars and two unguent jars in the tomb , which belongs to an unidentifed person who lived during the 12th Dynasty ( 1991-1786 BC ) in the Middle Kingdom .	B-PER O O O O O B-LOC I-LOC O B-LOC I-LOC O O O B-MISC O O O O O O O O O O O O O O O O O O O B-MISC I-MISC O O B-MISC O O O B-LOC I-LOC O
Justice Minister Stefaan De Clerck has admitted that mistakes were made and ordered an inquiry at the same time as stressing there were no indications of a cover-up .	B-ORG O B-PER I-PER I-PER O O O O O O O O O O O O O O O O O O O O O O O O
U.S. boy , 13 , accused of murdering adoptive mother .	B-LOC O O O O O O O O O O
15-13 15-11 15-2	O O O
said the 37-year-old veteran .	O O O O O
-DOCSTART-	O
English division one - West Bromwich v Sheffield United .	B-MISC O O O B-ORG I-ORG O B-ORG I-ORG O
TEXAS AT MINNESOTA	B-ORG O B-LOC
Cleveland 2 DETROIT 1	B-ORG O B-ORG O
However , trade will likely be light and prices could drift on evening up ahead of the report .	O O O O O O O O O O O O O O O O O O O
A U.S.-led air force has protected Iraqi Kurds against attack from Baghdad since shortly after the Gulf War in 1991 .	O B-MISC O O O O B-MISC I-MISC O O O B-LOC O O O O B-MISC I-MISC O O O
The eight-year war between the two countries ended with a U.N.-sponsored ceasefire .	O O O O O O O O O O B-MISC O O
number of games won .	O O O O O
Standings ( tabulate under played , won , drawn , lost , points for , against , percentage , total points ) :	O O O O O O O O O O O O O O O O O O O O O O O
Nigerian terms jeopardize Commonwealth trip-Canada .	B-MISC O O B-ORG B-MISC O
" Egypt will contact the British government to find out the truth of the matter and to discuss the possible consequences of such an unfortunate step , " he added .	O B-LOC O O O B-MISC O O O O O O O O O O O O O O O O O O O O O O O O O
It sponsored last week 's U.N. Security Council resolution threatening a ban on Sudanese flights abroad if Khartoum does not hand over three men accused in the Addis Ababa incident .	O O O O O B-ORG I-ORG I-ORG O O O O O B-MISC O O O B-LOC O O O O O O O O O B-LOC I-LOC O O
DETROIT 47 86 .353 27 1/2	B-ORG O O O O O
STATEMENT OF THE COUNCIL 'S REASONS END OF DOCUMENT .	O O O O O O O O O O
" There are people who are taking advantage of the news to put pressure on rates , however , there are enough players who will buy and that will keep rates from rising too much , " said one dealer .	O O O O O O O O O O O O O O O O O O O O O O O O O O O O O O O O O O O O O O O O O
The main Friday prayers in southern Jordan that were the starting point for the riots a week ago passed peacefully under tight security imposed by the army with only brief demonstrations reported .	O O O O O O B-LOC O O O O O O O O O O O O O O O O O O O O O O O O O O
Volendam 0 .	B-ORG O O
MONTREAL 70 59 .543 11	B-ORG O O O O
DETROIT AT KANSAS CITY	B-ORG O B-LOC I-LOC
79 Tom Watson	O B-PER I-PER
Halftime 1-1 .	O O O
TORONTO 1996-08-24	B-LOC O
Did not finish :	O O O O
0-0 .	O O
BALTIMORE 68 61 .527 6	B-ORG O O O O
The challenge was just for me to keep playing my own game . "	O O O O O O O O O O O O O O
Sri Lanka , playing in front of their home crowd for the first time since winning the World Cup last March , comfortably passed India 's modest 226-5 from 50 overs in 44.2 overs .	B-LOC I-LOC O O O O O O O O O O O O O O O B-MISC I-MISC O O O O O B-LOC O O O O O O O O O O
He said that security officials often visit his shop to make sure he was not selling the books .	O O O O O O O O O O O O O O O O O O O
Sjeng Schalken ( Netherlands ) vs. Gilbert Schaller ( Austria )	B-PER I-PER O B-LOC O O B-PER I-PER O B-LOC O
" This treaty is both necessary and good , " Nastase said , adding that the PUNR 's stance was threatening its position in the government .	O O O O O O O O O O B-PER O O O O O B-ORG O O O O O O O O O O
VfB Stuttgart 3 3 0 0 10 1 9	B-ORG I-ORG O O O O O O O
2. Patricia Djate ( France ) 4:02.26	O B-PER I-PER O B-LOC O O
Results from the	O O O
3. Sven Teutenberg ( Germany ) U.S. Postal	O B-PER I-PER O B-LOC O B-ORG I-ORG
" I have my own car now and that helps , " said Martinez .	O O O O O O O O O O O O O B-PER O
" Georges Zicot was arrested and will be charged with truck theft , insurance fraud and document forgery , " Bourlet told a news conference .	O B-PER I-PER O O O O O O O O O O O O O O O O O B-PER O O O O O
Evert will depart for Alexandroupolis on Saturday afternoon .	B-PER O O O B-LOC O O O O
Borussia Dortmund 3 2 0 1 9 5 6	B-ORG I-ORG O O O O O O O
16,000 .	O O
6. Baldato 77	O B-PER O
Major League Baseball	B-MISC I-MISC I-MISC
Currently , the dollar stands at about 1.48 marks and 109 yen .	O O O O O O O O O O O O O
Shelbourne - Mark Rutherford ( 5th )	B-ORG O B-PER I-PER O O O
It 's not a question we ask any more .	O O O O O O O O O O
California 7 NEW YORK 1	B-ORG O B-ORG I-ORG O
The Organisation for Security and Cooperation in Europe , which is running the election , allowed the ballot to be held on Sunday in four Hungarian refugee camps .	O B-ORG I-ORG I-ORG I-ORG I-ORG I-ORG I-ORG O O O O O O O O O O O O O O O O O B-MISC O O O
In the central bank 's latest bid to jumpstart Taiwan 's sluggish economy , Sheu ordered a reduction of up to a half-percentage point in banks ' reserve requirements and called on commercial banks to pass on the savings in the form of interest rate reductions .	O O O O O O O O O B-LOC O O O O B-PER O O O O O O O O O O O O O O O O O O O O O O O O O O O O O O O O
The court rejected Sieg 's argument that Lauck 's extradition from Denmark , where he was arrested in March last year at the request of German authorities , was illegal .	O O O B-PER O O O B-PER O O O B-LOC O O O O O O O O O O O O O B-MISC O O O O O
Delivery Date : 08/29/1996	O O O O
Leeds 1 Wimbledon 0	B-ORG O B-ORG O
Asif Mujtaba 2 3 0 90 51 30.00	B-PER I-PER O O O O O O
- Istanbul chamber of commerce urges Ankara to resume trade with Iraq .	O B-LOC O O O O B-LOC O O O O B-LOC O
Playing Sunday :	O O O
Attendance 48,123 .	O O O
The question of whether Perry should resign remained open , the Pennsylvania Republican said .	O O O O B-PER O O O O O O B-LOC B-MISC O O
According to a senior campaign official , Clinton " will be making a lot of news in the coming week -- something different each day . "	O O O O O O O B-PER O O O O O O O O O O O O O O O O O O O
-DOCSTART-	O
Auxerre 0 Marseille 0	B-ORG O B-ORG O
M / SP / F : NA / NA / NA BOOK ENTRY : Y	O O O O O O O O O O O O O O O
3 - Arantxa Sanchez Vicario ( Spain ) beat Nicole Arendt ( U.S. )	O O B-PER I-PER I-PER O B-LOC O O B-PER I-PER O B-LOC O
North Sydney 46 South Sydney 4	B-ORG I-ORG O B-ORG I-ORG O
90th , Witechek 59th ) .	O O B-PER O O O
42. Slovenia 7.77	O B-LOC O
VENTURA , Calif. 1996-08-28	B-LOC O B-LOC O
- The Lebanese Association for the Democracy of Elections cited 51 incidents of violation in the north Lebanon round .	O O B-ORG I-ORG I-ORG I-ORG I-ORG I-ORG I-ORG O O O O O O O O B-LOC O O
Mentmore Abbey said on Tuesday that merger discussions were taking place with the board of British Data Management , an information resource management and archive storage company .	B-ORG I-ORG O O O O O O O O O O O O O B-ORG I-ORG I-ORG O O O O O O O O O O
The work was inspired by a National Park Service plan to put computer databases at Civil War battlefields across the country so that Americans might research their ancestors .	O O O O O O B-ORG I-ORG I-ORG O O O O O O B-MISC I-MISC O O O O O O B-MISC O O O O O
ooOOoo	O
TALLINN 1996-08-28	B-LOC O
The continued strong tone to cash cattle and beef markets should prompt further support .	O O O O O O O O O O O O O O O
Hapoel Kfar Sava 0 Hapoel Zafririm Holon 1	B-ORG I-ORG I-ORG O B-ORG I-ORG I-ORG O
Zaire installs first election delegates .	B-LOC O O O O O
140 Robert Allenby ( Australia ) 69 71 , Mark Roe 69 71	O B-PER I-PER O B-LOC O O O O B-PER I-PER O O
Leading placings in	O O O
" Somebody threw a molotov cocktail over the fence and it went into the parking lot .	O O O O O O O O O O O O O O O O O
2. Brian Bronson ( U.S. ) 49.67	O B-PER I-PER O B-LOC O O
Jos Verstappen ( Netherlands ) 1	B-PER I-PER O B-LOC O O
The government-appointed watchdog , Human Rights National Observatory , was quoted this month by local newspapers as saying about 1,400 civilians have died in bomb attacks blamed on Moslem rebels in the past two years .	O O O O B-ORG I-ORG I-ORG I-ORG O O O O O O O O O O O O O O O O O O O O B-MISC O O O O O O O
Bolton 3 2 1 0 5 2 7	B-ORG O O O O O O O
He said Turkey considered Jordan a suitable country with which to cooperate on Middle East matters .	O O B-LOC O B-LOC O O O O O O O O B-LOC I-LOC O O
The Chechens said a renegade group seized the weapons and said on Monday they had all been returned .	O B-MISC O O O O O O O O O O O O O O O O O
18. Peter Mitchell 170,952	O B-PER I-PER O
( 7-2 ) 6-4 6-4	O O O O O
Thiel has managed to get most of the Olympic 100 metres champions since 1948 to attend the meeting , which is being held in the stadium where Owens won four gold medals 60 years ago at the Berlin Olympics .	B-PER O O O O O O O B-MISC O O O O O O O O O O O O O O O O O O B-PER O O O O O O O O O B-LOC B-MISC O
1 - Arantxa Sanchez Vicario ( Spain ) beat Katarina Studenikova	O O B-PER I-PER I-PER O B-LOC O O B-PER I-PER
Wisla Krakow 1 Gornik Zabrze 0	B-ORG I-ORG O B-ORG I-ORG O
BASEBALL - MAJOR LEAGUE RESULTS SUNDAY .	O O B-MISC I-MISC O O O
VfL Bochum 3 1 2 0 3 2 5	B-ORG I-ORG O O O O O O O
8. Jose Moreno ( Spain ) 1:05.219	O B-PER I-PER O B-LOC O O
Penrith 21 6 1 14 339 448 13	B-ORG O O O O O O O
Dan Jewell of the Whittier , Alaska police department described Phan as " extremely cooperative " . "	B-PER I-PER O O B-LOC O B-LOC O O O B-PER O O O O O O O
17 will be that he did not kill the victims .	O O O O O O O O O O O
11. David Coulthard ( Britain ) McLaren 37 laps completed	O B-PER I-PER O B-LOC O B-ORG O O O
20 Year A-rated Gen'l Obligation 5.55 % 5.50 % +0.05	O O O O O O O O O O
A Nigerian human rights group said on Wednesday that four members of a recently banned university union had been arrested .	O B-MISC O O O O O O O O O O O O O O O O O O O
Slovan Bratislava 4 3 0 1 7 2 9	B-ORG I-ORG O O O O O O O
Hostilities between the two warring Iraqi Kurdish factions have continued in the last few days despite a U.S.-brokered ceasefire last Friday .	O O O O O B-MISC I-MISC O O O O O O O O O O B-MISC O O O O
MOTORCYCLING - SAN MARINO GRAND PRIX PRACTICE TIMES .	O O B-LOC I-LOC B-MISC I-MISC O O O
