text_a	label
Kate Michelman , president of the National Abortion Rights Action League , described how she had an abortion at a time when the procedure was illegal after her husband abandoned her with three young children .	B-PER I-PER O O O O B-ORG I-ORG I-ORG I-ORG I-ORG O O O O O O O O O O O O O O O O O O O O O O O O O
TEXAS 74 55 .574 -	B-ORG O O O O
BALANCE - Ohio refunding bonds at $ 290,000 .	O O B-LOC O O O O O O
Aggregate 1-1 .	O O O
Shrewsbury 3 2 1 0 6 3 7	B-ORG O O O O O O O
" There will be tough matches but I hope I can get there , " she said . "	O O O O O O O O O O O O O O O O O O O
Croft , who was one of the few Englishmen to make a good impression in his test debut at The Oval last week , showed great control as he first dried up the early flow of Pakistan runs and then collected the wickets of Aamir Sohail and Wasim Akram in a spell of 10-1-36-2 .	B-PER O O O O O O O B-MISC O O O O O O O O O O B-LOC I-LOC O O O O O O O O O O O O O O O B-LOC O O O O O O O B-PER I-PER O B-PER I-PER O O O O O O
Chernomorets Novorossiisk 25 7 5 13 25 38 26	B-ORG I-ORG O O O O O O O
Police said the killings occurred on Saturday morning in the municipality of Anza but news of the massacre only reached the provincial capital of Medellin early on Sunday .	O O O O O O O O O O O O B-LOC O O O O O O O O O O O B-LOC O O O O
Outlook for a bullish cattle-on-feed report is also expected to lend support and prompt some bull spreading , analysts said .	O O O O O O O O O O O O O O O O O O O O O
LONDON 1996-08-26	B-LOC O
-DOCSTART-	O
A Costain spokesman told Reuters : " We 've had all sorts of protests at the head office and the chief executive 's house .	O B-ORG O O B-ORG O O O O O O O O O O O O O O O O O O O O
NEW YORK 1996-08-25	B-LOC I-LOC O
Arafat said he replied : " is this like their previous promises ? "	B-PER O O O O O O O O O O O O O
Rita Grande ( Italy ) beat Tina Krizan ( Slovenia ) 6-2 6-0	B-PER I-PER O B-LOC O O B-PER I-PER O B-LOC O O O
When asked whether the three guards would travel back to Kandahar or the Afghan capital Kabul , the embassy official said : " That has not been decided , but possibly Kandahar . "	O O O O O O O O O O B-LOC O O B-MISC O B-LOC O O O O O O O O O O O O O O O B-LOC O O
15 - Gabriela Sabatini ( Argentina ) beat Ann Grossman ( U.S. ) 6-2 6 - 3	O O B-PER I-PER O B-LOC O O B-PER I-PER O B-LOC O O O O O
Higher spending by foreign visitors and less Canadian tourist spending abroad cut the deficit in Canada 's international travel account by 26.5 percent in the second quarter , Statistics Canada said on Thursday .	O O O O O O O B-MISC O O O O O O O B-LOC O O O O O O O O O O O O B-ORG I-ORG O O O O
Mikael Tillstrom ( Sweden ) beat Tamer El Sawy ( Egypt ) 1-6 7-6 ( 9	B-PER I-PER O B-LOC O O B-PER I-PER I-PER O B-LOC O O O O O
( YMCA Proj .	O B-ORG O O
The 7-pound , 4-ounce ( 3.3 kg ) girl , named Sophia Rose , was born shortly after midnight at South Miami Hospital , publicist Paul Bloch said .	O O O O O O O O O O O B-PER I-PER O O O O O O O B-LOC I-LOC I-LOC O O B-PER I-PER O O
CRICKET - RUN-OUT GIVES LEWIS AND ENGLAND SLIM SATISFACTION .	O O O O B-PER O B-LOC O O O
9. Alexandre Barros ( Brazil ) Honda 1:51.784	O B-PER I-PER O B-LOC O B-ORG O
" Our bonds were better bid initially but they sold off on a lack of demand , and the short end went with it too on a lower currency .	O O O O O O O O O O O O O O O O O O O O O O O O O O O O O O
Standings :	O O
Col .	B-LOC O
The boat had been missing since Monday afternoon when it left the tiny island of Gorgona off Colombia 's southwest coast with sightseers for a return trip to Narino province , near the border with Ecuador .	O O O O O O O O O O O O O O O B-LOC O B-LOC O O O O O O O O O O B-LOC O O O O O O B-LOC O
Feyenoord Rotterdam 2 1 1 0 4 1 4	B-ORG I-ORG O O O O O O O
SOCCER - SCOTTISH LEAGUE RESULTS .	O O B-MISC O O O
delivered to consumer	O O O
THAWRA	B-ORG
Standings after games played on Wednesday ( tabulate under	O O O O O O O O O
" We have not had any sightings , but we suspect he is armed , possibly with a .22 rifle and / or a self-loading shotgun .	O O O O O O O O O O O O O O O O O O O O O O O O O O O
MANCHESTER , England 1996-08-28	B-LOC O B-LOC O
Halftime 0-0 .	O O O
Gazeta Wyborcza quoted Rosati as saying Yeltsin was very ill and effectively on leave , but for now retained control in Russia although matters were passing into the hands of his close collaborators .	B-ORG I-ORG O B-PER O O B-PER O O O O O O O O O O O O O O B-LOC O O O O O O O O O O O O
Up to today , we have no knowledge of any nurse stranded or kept in Libya without her will , and we have not received any complaint , " the Polish embassy 's charge d'affaires in Tripoli , Tadeusz Awdankiewicz , told Reuters by telephone .	O O O O O O O O O O O O O O O B-LOC O O O O O O O O O O O O O O B-MISC O O O O O B-LOC O B-PER I-PER O O B-ORG O O O
Now , I resign so I will not become the issue , " he said .	O O O O O O O O O O O O O O O O
2 - Zhang Ning ( China ) beat 1 - Wang Chen ( China ) 11-7 11-8	O O B-PER I-PER O B-LOC O O O O B-PER I-PER O B-LOC O O O
Aarau 1 Young Boys 0	B-ORG O B-ORG I-ORG O
Police used a huge crane to lift a bulldozer over the Old City 's walls to reach the building amidst narrow alleys , witnesses said .	O O O O O O O O O O O B-LOC I-LOC O O O O O O O O O O O O O
CENTRAL DIVISION	B-MISC I-MISC
The government had been threatening to fire the workers since the strike began on Tuesday , saying it was illegal .	O O O O O O O O O O O O O O O O O O O O O
Gold Coast 21 5 1 15 351 483 11	B-ORG I-ORG O O O O O O O
Hashimoto , who has already visited Mexico and Chile , spent three days in Brazil .	B-PER O O O O O B-LOC O B-LOC O O O O O B-LOC O
Spal 2 Reggiana 4	B-ORG O B-ORG O
NEW YORK 1996-08-27	B-LOC I-LOC O
-DOCSTART-	O
" The Oriente will be supplied by the same seller at a small premium to formula , " a trade source said , referring to the first October cargo sold two weeks ago at Petroecuador 's sale formula plus five cents fob .	O O B-ORG O O O O O O O O O O O O O O O O O O O O O O O O O O O O O O O B-ORG O O O O O O O O
Mulder 's absence means that Northern Transvaal centre Andre Snyman should win his second cap alongside provincial colleague Danie van Schalkwyk .	B-PER O O O O B-ORG I-ORG O B-PER I-PER O O O O O O O O B-PER I-PER I-PER O
Halftime 2-2 .	O O O
Davenport had drawn one of the toughest first-round assignments of any of the seeded players in 17th-ranked Karina Habsudova of Slovakia .	B-PER O O O O O O O O O O O O O O O O B-PER I-PER O B-LOC O
" Every time the Senate hacks away at the budget , they hack away at the lower interest rate environment , " Howard told reporters on Thursday night after attending a Liberal Party function .	O O O O B-ORG O O O O O O O O O O O O O O O O O B-PER O O O O O O O O B-ORG I-ORG O O
Bradford 22 17 0 5 767 409 34	B-ORG O O O O O O O
To get those results , 27 percent of the companies surveyed plan to eliminate base pay increases in favour of cash bonuses and incentives , such as employee and team award programmes and education .	O O O O O O O O O O O O O O O O O O O O O O O O O O O O O O O O O O O
-DOCSTART-	O
- Chelsea Clinton , until now carefully shielded from the exposure of public life , made her political debut on Sunday on her father 's whistlestop train trip .	O B-PER I-PER O O O O O O O O O O O O O O O O O O O O O O O O O O
---	O
Oval on Friday :	B-LOC O O O
which we expect at the beginning of next year , " Grabowksi said .	O O O O O O O O O O O B-PER O O
-- Chicago newsdesk 312-408-8720--	O B-LOC O O
-- E. Auchard , Wall Street bureau , 212-859-1736	O B-PER I-PER O B-ORG I-ORG I-ORG O O
SOCCER - DUTCH FIRST DIVISION RESULTS / STANDINGS .	O O B-MISC O O O O O O
Finnish April trade surplus 3.8 billion markka - NCB .	B-MISC O O O O O O O B-ORG O
McCurry said that when Clinton delivers his acceptance address on Thursday night to fellow Democrats and a national television audience , he will " set out a road map " for the nation 's future -- one the president hopes guides him back to the White House for four more years .	B-PER O O O B-PER O O O O O O O O O B-MISC O O O O O O O O O O O O O O O O O O O O O O O O O O O O O O B-LOC I-LOC O O O O O
BONN 1996-08-22	B-LOC O
" There is much to discuss on the fall calendar , " acting chief spokesman Glyn Davies said . "	O O O O O O O O O O O O O O O B-PER I-PER O O O
" But we must avoid giving the impression this peace deployment in former Yugoslavia is being perceived in the long run as an occupation .	O O O O O O O O O O O O O B-LOC O O O O O O O O O O O
1964 - The Forth Road Bridge in Scotland , measuring 6156 ft , and with a centre span of 3300 ft , was opened by Her Majesty the Queen .	O O O B-LOC I-LOC I-LOC O B-LOC O O O O O O O O O O O O O O O O O O O O O O
Palestinians to strike over Jerusalem demolition .	B-MISC O O O B-LOC O O
Standings ( tabulate under played , won , drawn , lost , goals	O O O O O O O O O O O O O
-DOCSTART-	O
DHAKA 1996-08-22	B-LOC O
Numerous to scattered showers and thunderstorms in southern and central India , and isolated showers to the north Sunday through Tuesday .	O O O O O O O O O O B-LOC O O O O O O O O O O O
-DOCSTART-	O
Sampras opens the defence of his U.S. Open crown against David Rikl of the Czech Republic , while top-ranked Graf begins her title defence against Yayuk Basuki of Indonesia .	B-PER O O O O O B-MISC I-MISC O O B-PER I-PER O O B-LOC I-LOC O O O B-PER O O O O O B-PER I-PER O B-LOC O
Barbara Rittner ( Germany ) beat Katarina Studenikova ( Slovakia ) 7-5 7-5	B-PER I-PER O B-LOC O O B-PER I-PER O B-LOC O O O
PUK and Iraq 's Kurdistan Democratic Party ( KDP ) the two main Iraqi Kurdish factions , have had northern Iraq under their control since Iraqi forces were ousted from Kuwait in the 1991 Gulf War .	B-ORG O B-LOC O B-ORG I-ORG I-ORG O B-ORG O O O O B-MISC I-MISC O O O O O B-LOC O O O O B-MISC O O O O B-LOC O O O B-MISC I-MISC O
" Some nuclear powers stubbornly uphold policies of nuclear deterrence based on first use of nuclear weapons , " it said .	O O O O O O O O O O O O O O O O O O O O O O
GOV LAW GERMAN HOME CTRY = TAX PROVS STANDARD	O O B-MISC O O O O O O
Montpellier 3 0 2 1 1 2 2	B-ORG O O O O O O O
6. Aaron Slight ( New Zealand ) Honda 38:41.756	O B-PER I-PER O B-LOC I-LOC O B-ORG O
Peterborough 2 Crewe 2	B-ORG O B-ORG O
CHICAGO 1996-08-26	B-LOC O
Lebed , who met Russian Prime Minister Viktor Chernomyrdin on Monday to discuss the progress he made on a political settlement for the breakaway region , has been seeking a meeting with President Boris Yeltsin , who started a holiday near Moscow on Monday .	B-PER O O O B-MISC O O B-PER I-PER O O O O O O O O O O O O O O O O O O O O O O O O B-PER I-PER O O O O O O B-LOC O O O
Men 's 100 metres	O O O O
* Stock funds see cash pour in again in July .	O O O O O O O O O O O
Amanda Coetzer ( South Africa ) beat 6 - Anke Huber ( Germany ) 6-1 2-6 6-2	B-PER I-PER O B-LOC I-LOC O O O O B-PER I-PER O B-LOC O O O O
Results of South Korean	O O B-MISC I-MISC
SYDNEY 1996-08-28	B-LOC O
Bradford 2 1 0 1 3 2 3	B-ORG O O O O O O O
Winger Lee Sharpe hit a superb strike from the edge of the penalty area to give Leeds their first win of the season on Monday and leave hapless Wimbledon anchored at the bottom of the England premier league .	O B-PER I-PER O O O O O O O O O O O O O B-ORG O O O O O O O O O O O B-ORG O O O O O O B-LOC O O O
They show that the gendarmes were aware that Dutroux was building cells in some of his houses for holding children , yet this information was either not passed on to other police forces searching for the missing girls or was overlooked when it was .	O O O O O O O O B-PER O O O O O O O O O O O O O O O O O O O O O O O O O O O O O O O O O O O O
He was the 26th person executed this year in the kingdom .	O O O O O O O O O O O O
- Operating profit 46 vs 48	O O O O O O
81 Seiki Okuda ( Japan )	O B-PER I-PER O B-LOC O
Company name Companion Marble ( Holdings ) Ltd	O O B-ORG I-ORG O B-ORG O B-ORG
It will be sent for free .	O O O O O O O
LOS ANGELES 67 60 .528 2	B-ORG I-ORG O O O O
Salim Malik not out 2	B-PER I-PER O O O
LONG GILT ( SEP ) ( 1/32 ) 107-12 107-10 107-06	O O O O O O O O O O O
Dutch soccer captain Danny Blind has decided to end his international career , Ajax spokesman David Endt said on Sunday .	B-MISC O O B-PER I-PER O O O O O O O O B-ORG O B-PER I-PER O O O O
HORSE RACING - PIVOTAL ENDS 25-YEAR WAIT FOR TRAINER PRESCOTT .	O O O B-PER O O O O O B-PER O
That was not the amnesty committee where perpetrators are expected to open their hearts and souls and to tell it all . "	O O O O O O O O O O O O O O O O O O O O O O O
I think it will be more physically challenging and we 'll have to go up against more diverse situations due to the terrain , " said Dr. Michael Stroud , a veteran Eco-Challenge participant .	O O O O O O O O O O O O O O O O O O O O O O O O O O O B-PER I-PER O O O B-MISC O O
CENTRAL DIVISION	B-MISC I-MISC
Illawarra 21 8 0 13 395 432 16	B-ORG O O O O O O O
It was just like the World Cup , the ball came and the chance was there . '	O O O O O B-MISC I-MISC O O O O O O O O O O O
SOCCER - SPONSORS CASH IN ON RAVANELLI 'S SHIRT DANCE .	O O O O O O B-PER O O O O
Swansea 3 1 0 2 3 7 3	B-ORG O O O O O O O
Estonia 's parliament again failed to elect a new state president on Tuesday when neither of two candidates secured a majority in second-round voting .	B-LOC O O O O O O O O O O O O O O O O O O O O O O O O
Men 's singles	O O O
Fitzroy 21 1 0 20 1381 2778 49.7 4	B-ORG O O O O O O O O
Schalke 3 0 2 1 4 8 2	B-ORG O O O O O O O
The post and telecoms firm posted an 8.5 percent rise in first half earnings on Friday , just below analysts ' expectations .	O O O O O O O O O O O O O O O O O O O O O O O
Le Havre 1 Caen 1	B-ORG I-ORG O B-ORG O
15. Masanaga Shiohara ( Japan ) 1:06.615	O B-PER I-PER O B-LOC O O
Tight bowling from Glamorgan off-spinner Robert Croft helped England to restrict Pakistan to 225 for five in their 50 overs in the first one-day international at Old Trafford on Thursday .	O O O B-ORG O B-PER I-PER O B-LOC O O B-LOC O O O O O O O O O O O O O O B-LOC I-LOC O O O
1. Virna De Angeli ( Italy ) 55.66	O B-PER I-PER I-PER O B-LOC O O
On the other hand we must prevent any return of war and massacres " he said .	O O O O O O O O O O O O O O O O O
-DOCSTART-	O
The EU 's cereals management committee sold 234,324 tonnes of German intervention barley at a minimum price of 105.07 Ecus per tonne .	O B-ORG O O O O O O O O B-MISC O O O O O O O O B-MISC O O O
2. Shayne King 28	O B-PER I-PER O
Current loss 371 million vs loss 278 million	O O O O O O O O
NOTE - Orii Corp makes automation equipment .	O O B-ORG I-ORG O O O O
" Local radio and television there ( in Zvornik ) are advising people to step back and take it easy .	O O O O O O O O B-LOC O O O O O O O O O O O O
-- Sydney Newsroom 61-2 9373-1800	O B-ORG I-ORG O O
He met Russian Prime Minister Viktor Chernomyrdin on Monday and , according to the press service of Lebed 's Security Council , could meet Yeltsin on Tuesday .	O O B-MISC O O B-PER I-PER O O O O O O O O O O B-PER O B-ORG I-ORG O O O B-PER O O O
A Czech coach crashed and burst into flames on a southern Austrian motorway early on Saturday , killing one person and injuring 15 , police said .	O B-MISC O O O O O O O O O B-MISC O O O O O O O O O O O O O O O
LOS ANGELES AT MONTREAL	B-ORG I-ORG O B-LOC
The company has organised regular auctions of its shares to create an orderly market in the paper .	O O O O O O O O O O O O O O O O O O
Of the 218 shares traded , gainers outdid losers by 100 to 64 and 54 shares were stable .	O O O O O O O O O O O O O O O O O O O
Pope John Paul II and Israeli Foreign Minister David Levy sent her get-well messages , the Press Trust of India said .	B-PER I-PER I-PER O O B-MISC O O B-PER I-PER O O O O O O B-ORG I-ORG I-ORG I-ORG O O
Rain arrived just as the players left the field for lunch , forcing the ground-staff into action yet again .	O O O O O O O O O O O O O O O O O O O O
The Speaker of Bangladesh 's parliament , Humayun Rasheed Choudhury , said he had received death threats from anonymous callers after opposition parties threatened to boycott proceedings chaired by him .	O O O B-LOC O O O B-PER I-PER I-PER O O O O O O O O O O O O O O O O O O O O O
Dirk Dier ( Germany ) beat Chuck Adams ( U.S. ) 6-4 2-6 6-4 6-4	B-PER I-PER O B-LOC O O B-PER I-PER O B-LOC O O O O O
Elect Res May 25 43.0 32.0 6.0 12.0 4.0	B-ORG I-ORG O O O O O O O
1. Joseph Keter ( Kenya ) 8 minutes 10.02 seconds	O B-PER I-PER O B-LOC O O O O O
Dealers estimate that the shortfall will increase due to the inflow of funds before the end of the month .	O O O O O O O O O O O O O O O O O O O O
It ranged from 817.60 to 819.30 .	O O O O O O O
Results from the	O O O
RTRS - Queensland gunman evades police in bush hunt .	B-ORG O B-LOC O O O O O O O
- Blaming Iraq for riots in Jordan is a dirty game .	O O B-LOC O O O B-LOC O O O O O
-DOCSTART-	O
A. Stewart lbw b Waqar Younis 48	B-PER I-PER O O B-PER I-PER O
Aberdeen 4 Hearts 0	B-ORG O B-ORG O
" Until this is cleared up by the European Union 's scientific panels -- and we have asked this to be done as quickly as possible -- ( consumers ) should if at all possible give preference to sheepmeat from other countries , " ministry official Werner Zwingmann told ZDF television .	O O O O O O O O B-ORG I-ORG O O O O O O O O O O O O O O O O O O O O O O O O O O O O O O O O O O O O B-PER I-PER O B-ORG O O
Russia to clamp down on barter deals .	B-LOC O O O O O O O
PULPEX 's clearing operation will be covered by the parent company guarantee issued by OM Gruppen to its wholly-owned bourses and clearing organisations .	B-ORG O O O O O O O O O O O O O B-ORG I-ORG O O O O O O O O
( Sweden ) , Stephen Ames ( Trinidad and Tobago ) , Klas Eriksson	O B-LOC O O B-PER I-PER O B-LOC I-LOC I-LOC O O B-PER I-PER
" Our ambassador is in touch with the UAE foreign ministry .	O O O O O O O O B-LOC O O O
6. Endrio Leoni ( Italy ) Aki	O B-PER I-PER O B-LOC O B-PER
Benes ( 14-9 ) allowed five hits , walked five and struck out 10 for his 11th win in 12 decisions .	B-PER O O O O O O O O O O O O O O O O O O O O O
In a written statement released at the news conference , Gujral reiterated India 's objections to the treaty , under negotiation at the Conference on Disarmament in Geneva .	O O O O O O O O O O B-PER O B-LOC O O O O O O O O O O B-MISC I-MISC I-MISC O B-LOC O
Palestinian President Yasser Arafat said on Wednesday that Israel had declared war on the Palestinians and called for the first general strike in the West Bank and Gaza in two years .	B-MISC O B-PER I-PER O O O O B-LOC O O O O O B-MISC O O O O O O O O O B-LOC I-LOC O B-LOC O O O O
A U.S.-led air force in southern Turkey protects Iraqi Kurds from possible attacks by Baghdad troops .	O B-MISC O O O O B-LOC O B-MISC I-MISC O O O O B-LOC O O
Harding says others have done the same . "	B-PER O O O O O O O O
30,000 .	O O
The clause recognizes and welcomes Democrats with divergent views on abortion and states they have a full part to play at all levels of the party .	O O O O O B-MISC O O O O O O O O O O O O O O O O O O O O O
-DOCSTART-	O
Many had taken part in the genocide that year of one million people , mostly Tutsis , and refuse to go home for fear of reprisal at the hands of the new Tutsi-dominated government in Kigali .	O O O O O O O O O O O O O O O B-MISC O O O O O O O O O O O O O O O O B-MISC O O B-LOC O
15 equal .	O O O
WHEAT--Rains boost U.S. HRW planting prospects .	O O B-LOC O O O O
The dollar weakened during the day with many dealers sidelined because of uncertainty over Tokyo 's monetary direction ahead of the important Japanese Tankan economic survey out on Wednesday .	O O O O O O O O O O O O O O B-LOC O O O O O O O B-MISC B-ORG O O O O O O
Sparta Rotterdam 2 0 1 1 0 1 1	B-ORG I-ORG O O O O O O O
DHAKA 1996-08-27	B-LOC O
2. Alessandro Lambruschini ( Italy ) 7:47.78	O B-PER I-PER O B-LOC O O
" This is our first decision in federal distrct court regarding a dispute with Medicare , " Gildea said . "	O O O O O O O O O O O O O O B-MISC O O B-PER O O O
The Red Sox are two games over .500 for the first time this season .	O B-ORG I-ORG O O O O O O O O O O O O
Afghan Deputy Prime Minister Qotbuddin Hilal officiated at the reopening ceremony , which was delayed by several hours while the two sides argued about a mutual release of prisoners .	B-MISC O O O B-PER I-PER O O O O O O O O O O O O O O O O O O O O O O O O
Further plans , he said , called for full provision of resources like fertiliser and herbicides for 25 percent of Ukraine 's arable land next year , for 50 percent in 1998 and 100 percent of the land in 1999 .	O O O O O O O O O O O O O O O O O O O O B-LOC O O O O O O O O O O O O O O O O O O O O
Amica Wronki 3 Hutnik Krakow 0	B-ORG I-ORG O B-ORG I-ORG O
NAC Breda 2 1 0 1 1 1 3	B-ORG I-ORG O O O O O O O
Vinny Castilla and Dante Bichette each added two RBI for Colorado , which improved the major league 's best home mark to 44-20 .	B-PER I-PER O B-PER I-PER O O O B-MISC O B-LOC O O O O O O O O O O O O O
Wasim rattled along to 30 not out , outscoring his partner who was unbeaten on 24 at the break , although the weather was again threatening to play the dominant role .	B-PER O O O O O O O O O O O O O O O O O O O O O O O O O O O O O O O
Spring Chg Durum ( m ) Chg White Chg	O O O O O O O O O
The girl was being held on the boat and had sought help from a passer-by , police chief inspector Ilkka Laasonen said .	O O O O O O O O O O O O O O O O O O O B-PER I-PER O O
69 Jose Coceres ( Argentina ) , Raymond Russell , Robert Allenby	O B-PER I-PER O B-LOC O O B-PER I-PER O B-PER I-PER
Daoud said .	B-PER O O
7 - Jana Novotna ( Czech Republic ) beat Florencia Labat ( Argentina ) 6-2 4-6 6-2	O O B-PER I-PER O B-LOC I-LOC O O B-PER I-PER O B-LOC O O O O
Maturing credits are seen at 2.209 billion pesos , and there is an oversupply of 684 billion pesos from the primary auction .	O O O O O O O O O O O O O O O O O O O O O O O
RTRS - Newcrest Q4 net profit A$ 4.3 mln .	B-ORG O B-ORG I-ORG O O B-MISC O O O
3. Philip Kibitok ( Kenya ) 1:46.09	O B-PER I-PER O B-LOC O O
CRICKET - BOTHAM DISMISSES GATTING IN FIRST CLASS DEBUT .	O O B-PER O B-PER O O O O O
Hopefully , this will have been my nerves for the whole tournament . "	O O O O O O O O O O O O O O
Their teenaged son sat in a VIP box with first lady Hillary Rodham Clinton and watched as his father returned to his wheelchair .	O O O O O O O O O O O B-PER I-PER I-PER O O O O O O O O O O
CHICAGO 1996-08-22	B-LOC O
5. Fatima Yussuf ( Nigeria ) 50.14	O B-PER I-PER O B-LOC O O
Chinese officials have said such dissidents may not become Hong Kong permanent residents since they entered the territory illegally but have also said their status would be decided by the post-1997 local Hong Kong administration .	B-MISC O O O O O O O O B-LOC I-LOC O O O O O O O O O O O O O O O O O O O O O B-LOC I-LOC O O
Darlington 1 Colchester 1	B-ORG O B-ORG O
But one source , the head of a Hong Kong trading house , said it made no difference if the copper was customs cleared or not .	O O O O O O O O B-LOC I-LOC O O O O O O O O O O O O O O O O O
In its weekly report released Monday , the service said Kansas topsoil moisture was rated eight percent surplus , 77 percent adequate and 15 percent short to very short .	O O O O O O O O O O B-LOC O O O O O O O O O O O O O O O O O O O
Sao Paulo midfielder Andre and Santos defender Narciso were both substituted during their teams ' game , taken to Sao Paulo airport and flown to Rio de Janeiro in a private jet chartered by the Brazilian Football Confederation ( CBF ) .	B-ORG I-ORG O B-PER O B-ORG O B-PER O O O O O O O O O O O B-LOC I-LOC O O O O B-LOC I-LOC I-LOC O O O O O O O B-MISC I-MISC I-MISC O B-MISC O O
At Colchester : Gloucestershire 280 ( J. Russell 63 , A. Symonds	O B-LOC O B-ORG O O B-PER I-PER O O B-PER I-PER
Chinese official media has often accused foreign forces , notably the United States , of seeking to support Tibetan independence activists .	B-MISC O O O O O O O O O O B-LOC I-LOC O O O O O B-MISC O O O
No2 Refined 75 to 77 cents / pound	O O O O O O O O
NEW DELHI 1996-08-22	B-LOC I-LOC O
Bristol City 0 Blackpool 1	B-ORG I-ORG O B-ORG O
3. John Regis ( Britain ) 20.63	O B-PER I-PER O B-LOC O O
-- Garry West , Amsterdam newsroom +31 20 504 5000	O B-PER I-PER O B-LOC O O O O O
6. Erik Breukink ( Netherlands ) Rabobank 48	O B-PER I-PER O B-LOC O B-ORG O
-- Prague Newsroom , 42-2-2423-0003	O B-ORG I-ORG O O
Hungary 's gross foreign debt rose to $ 27.53 billion in June from $ 27.25 billion in May , the	B-LOC O O O O O O O O O O O O O O O O O O O
Trading will resume on Thursday .	O O O O O O
Argentine bishop reminds cabinet of Commandments .	B-MISC O O O O O O
The study involved 115 people with high blood cholesterol levels .	O O O O O O O O O O O
-- London Newsroom , +44 171 542 8980	O B-ORG I-ORG O O O O O
Lotte 1 OB 0*	B-PER O B-ORG O
Speaking in Santa Barbara , California , Dole did not directly refer to the sexual scandal but said the departure of Morris , who had advised Clinton to chart a more centrist political course , would make Clinton drift back to the left .	O O B-LOC I-LOC O B-LOC O B-PER O O O O O O O O O O O O O B-PER O O O O B-PER O O O O O O O O O O B-PER O O O O O O
CRICKET - ENGLAND BEAT PAKISTAN IN FIRST ONE-DAYER .	O O B-LOC O B-LOC O O O O
-DOCSTART-	O
The Russians , who said they overpowered the guards -- two armed with Kalashnikov automatic rifles -- while doing regular maintenance work on their Ilyushin 76 cargo plane last Friday , left the UAE capital Abu Dhabi for home on Sunday .	O B-MISC O O O O O O O O O O O B-MISC O O O O O O O O O O B-MISC I-MISC O O O O O O O B-LOC O B-LOC I-LOC O O O O O
